date,title,content,articles,url
11/20/2022,Ukraine's Hope for a Green Future Burns Bright Amid Environmental Devastation,"Ukraine came to COP27 bearing its scars from Russia's war, but also imagining its green future.","Start video
Large play-pause toggle
Play pause
Fullscreen
News
Politics
Ukraine's Hope for a Green Future Burns Bright Amid Environmental Devastation

Ukraine came to COP27 bearing its scars from Russia's war, but also imagining its green future.

Katie Collins
Senior European Correspondent
Katie a UK-based news reporter and features writer. Officially, she is CNET's European correspondent, covering tech policy and Big Tech in the EU and UK. Unofficially, she serves as CNET's Taylor Swift correspondent. You can also find her writing about tech for good, ethics and human rights, the climate crisis, robots, travel and digital culture. She was once described a ""living synth"" by London's Evening Standard for having a microchip injected into her hand.
See full bio
Katie Collins
Nov. 20, 2022 5:00 a.m. PT
6 min read

Russia's war has devastated Ukraine's built and natural environments.

Maxym Marusenko/Getty Images
This story is part of CNET Zero, a series that chronicles the impact of climate change and explores what's being done about the problem.

Next door in the Australian pavilion, chipper baristas serve the best flat whites in town, while across the way at the Brazil booth, splashes of yellow, blue and green mingle hypnotically across digital displays. But at Ukraine's pavilion, all is dark and somber.

This is the first year that Ukraine has had its own country pavilion at the UN's climate summit, COP27, which is taking place in Sharm el-Sheikh, Egypt, this week. The space functions as a visual metaphor for the current state of the country, with gray slanting walls, a tree trunk studded with bullets, and a tall cylindrical space featuring samples of damaged soil from all over Ukraine -- a tomb for the country's lost and damaged biodiversity.

Over the past two weeks, tears have been shed here, including those of Ukraine's Minister of Environmental Protection and Natural Resources, Ruslan Strilets, as he welcomed a crowd of reporters into the small space on Monday evening. ""This pavilion is a place of unity for all friends of Ukraine,"" he said, a single tear sliding down his cheek.

He seemed taken aback by the turnout, with at least 50 people crowding into the small booth, but there's been no shortage of solidarity for Ukraine at this summit. Russia's war has not only caused death and devastation within the country, it's also sparked a global energy crisis that's caused the cost of living to shoot up all over the world.

Likewise, the destruction of nature in Ukraine -- or anywhere else for that matter -- is a problem for all of us. As Strilets put it: ""The environment has no border."" Nature is one of our most powerful allies in the battle to minimize the worst effects of the climate crisis. It sucks out of the atmosphere all of the carbon we've pumped into it over the years, helping to provide some relief to our rapidly warming world. Destruction of biodiversity and natural habitats sets the collective race back, and in Ukraine, the devastation has been extensive.

""The environment is always the victim of conflict,"" said Inger Andersen, head of the United Nations Environment Programme, who's been involved in analyzing the environmental damage of several wars. ""Conflict leaves a toxic legacy that is carried by generations,"" she added, while speaking at the launch event of Ukraine's global platform for assessing environmental damage caused by military action.

At the launch, Strilets presented a summary of what has happened in his country. Russia's war in Ukraine is still ongoing, but in the past eight months since Russia invaded, the conflict has already caused 2,239 recorded cases of environmental damage and placed a fifth of Ukraine's protected areas under threat.

Soil samples from Ukraine displayed at the country's COP27 pavilion.

Katie Collins/CNET

Forests in the country have been especially hard hit, as they've been heavily occupied by the Russian military and see the heaviest fighting, with many suffering fires. Around 450,000 hectares of forest lie within occupied or hostile zones, with 63 separate forestries under occupation. ""The Russians have turned our natural resources into military bases,"" said Strilets.

When it comes to biodiversity, around 600 animal species are under threat, and 750 species of plants and fungi, according to government calculations. Since the end of February there have been 120 cases of dolphins being killed in the Ukrainian part of the Black Sea.

This year, Ukraine is on track to exceed its 2021 emissions due to the pollution caused by the Russian military. While the rest of the world is discussing weaning itself off fossil fuels, Ukraine is once again forced to discuss the fight against pollution, Strilets said.

A brighter, greener future for Ukraine

It wasn't supposed to be this way. Before Russia's invasion, Ukraine was preparing to formally apply for EU membership, and as part of this preparation, it was planning to align itself fully with EU green directives. But the war has thrown its plans for a green transition way off course.

Now, with his eyes fixed on the future, Strilets foresees a ""unique opportunity"" to rebuild Ukraine as a green country that generates and subsists on renewable energy. Featured at the Ukrainian Pavilion at COP27 were several exhibits detailing how the country will become a green leader. A printed message from Ukrainian President Volodymyr Zelenskyy read: ""Ukraine can, and I am certain will, become a green energy hub for Europe.""

Models of wind turbines were accompanied by a caption explaining the country's plan to generate 30GW annually of renewable energy by 2030 (it already produces 13GW per year) and export 15 of those gigawatts to Europe. It's about more than just rebuilding, said the caption said, it's about creating something new that will make Ukraine an important part of the EU's energy security.

""Ukraine should march from the ashes of this war as a climate-neutral society,"" said Natalia Andrusevych, chair of the board of directors of the Resource & Analysis Center, speaking via Zoom at the event. Andrusevych has written a policy brief on postwar reconstruction that models sustainable development for Ukraine.

Making Russia pay

This green reconstruction will be astronomically expensive. Ukraine has calculated the environmental damage the Russian military has already caused at more than $39 billion. Speaking over Zoom at the event, Alanna Simpson, lead disaster risk management specialist from the World Bank, said that taking into account the damage done only until June 1, around $349 billion would be needed for recovery and reconstruction.

This bill isn't just for simply rebuilding what's been lost, it's about ensuring Ukraine is well set up for the future. ""We don't want to rebuild a 1960s school to 1960s standards,"" said Simpson. Instead, she added, it must be green.

To pay for it, Strilets, Andrusevych and many others from Ukraine are talking about seeking reparations not only from Russia, but also from the fossil fuel companies that are profiting from the conflict. Russia ""aims to turn the entire planet into a bomb shelter,"" said Strilets, and should be held accountable not just by Ukraine, but by the whole world for the environmental damage it's causing.

Displayed at Ukraine's COP27 pavilion: shrapnel lodged in a tree trunk.

Katie Collins/CNET

This is a central part of the work the grassroots activist organization Razom We Stand is currently undertaking, said activist and lawyer Svitlana Romanko. She and many other Ukrainians, including those who are displaced or are refugees, have come to COP27 this year because they believe that not enough people understand that the money Russia continues to earn from fossil fuels is financing the war in their country. ""Both supply and demand side for the fossil fuel industry need to be seriously cut off,"" said Romanko.

Their presence at the conference has brought them face-to-face with members of the Russian delegation and fossil fuel executives, which has left them feeling deeply angry and disrespected. Last week, Romanko confronted Patrick Pouyanné, the CEO of French energy company Total -- which Razom We Stand is currently trying to sue. She asked him whether he'll use the blood money he's made through Russia's war to finance Ukraine's reconstruction. ""Probably,"" he told her in response, patting her arm in a way she said felt ""patronizing.""

Total didn't respond to a request for further comment.

Romanko's hope is that any money recouped from oil companies and from Russia is used to help Ukraine decarbonize while rebuilding, spurring the country's development and making it safe, secure and self-sufficient for generations to come. ""We don't want that cheap, dirty money to rebuild business as usual,"" she said. ""We want to create a precedent where that money is used for the green transition.""

There are plans in the works to take advantage of greener construction methods and to rebuild in the style of the New European Bauhaus initiative, which brings people from different disciplines together to create sustainable, affordable and accessible buildings.

""We want to be the great powerful example for how to rebuild,"" said Romanko. She envisions a Ukraine that runs on ""community-owned distributed green energy that does not kill,"" and where people can wake up in the morning, look out of their windows and not see explosions, but a safe, green country.

Ukraine has spent nine months under constant bombardment from the Russian military, and is now facing the long, hard, cold winter ahead. In spite of this, Romanko, Strilets and the many other Ukrainians have joined the ranks of those fighting the climate crisis at COP27 and are refusing to let die their vision of a future that's free of fossil fuels. ""Peace and freedom,"" said Romanko. ""That's what drives us.""

First published on Nov. 20, 2022 5:00 a.m. PT",https://www.cnet.com/news/politics/ukraines-hope-for-a-green-future-burns-bright-amid-environmental-devastation/
11/20/2022,"At COP27, Historic Deal Will Compensate Poor Nations for Climate Crisis Disasters",A win for vulnerable countries was offset by weak ambition in the final agreement to take necessary steps to limit global warming to 1.5 degrees Celsius.,"Start video
Large play-pause toggle
Play pause
Fullscreen
Science
Climate
At COP27, Historic Deal Will Compensate Poor Nations for Climate Crisis Disasters

A win for vulnerable countries was offset by weak ambition in the final agreement to take necessary steps to limit global warming to 1.5 degrees Celsius.

Katie Collins
Senior European Correspondent
Katie a UK-based news reporter and features writer. Officially, she is CNET's European correspondent, covering tech policy and Big Tech in the EU and UK. Unofficially, she serves as CNET's Taylor Swift correspondent. You can also find her writing about tech for good, ethics and human rights, the climate crisis, robots, travel and digital culture. She was once described a ""living synth"" by London's Evening Standard for having a microchip injected into her hand.
See full bio
Katie Collins
Nov. 20, 2022 1:45 a.m. PT
7 min read

Loss and damage has been the defining issue of COP27.

Katie Collins/CNET
This story is part of CNET Zero, a series that chronicles the impact of climate change and explores what's being done about the problem.

Developing countries, climate NGOs and activists celebrated a victory more than 30 years in the making on Sunday, as they welcomed the news that this year's UN climate summit, COP27, has resulted in the establishment of a funding mechanism for loss and damage. 

It marks an important breakthrough in multilateral climate negotiations that will see countries that are historically responsible for emitting the majority of greenhouse gases compensate those from vulnerable countries, who are the hardest hit. For something that many activists argue is long overdue, it can't come soon enough.

""The announcement offers hope to vulnerable communities all over the world who are fighting for their survival from climate stress,"" tweeted Sherry Rehman, the minister for climate change from Pakistan -- the country that's been leading the call for a loss and damage fund on behalf of the G77 countries and China at COP27. Pakistan has suffered from intense flooding this year that's killed more than 1,700 people and displaced over 2 million more. 

But the outcome of COP27 wasn't a resounding success. In particular, many involved in the COP process were surprised and frustrated that the text countries adopted didn't mention phasing down or phasing out fossil fuels. Climate talks often end this way -- with some wins and some losses, but the lack of focus on limiting global warming to 1.5 degrees Celsius by transitioning away from fossil fuels to renewables is something many working on climate action consider a massive loss.

""Our planet is still in the emergency room,"" UN Secretary General Antonio Guterres said in a speech following the close of COP27. ""We need to drastically reduce emissions now -- and this is an issue this COP did not address. A fund for loss and damage is essential -- but it's not an answer if the climate crisis washes a small island state off the map -- or turns an entire African country to desert.""

COP27 has been running for the past two weeks, starting Nov. 7, in Sharm el-Sheikh, a resort town on Egypt's Sinai peninsula. Alongside the core negotiations, there's been a whole program of events, with numerous protests and visits from heads of state thrown into the mix. The summit was set to close Friday, but it ran over as COPs usually do, dragging negotiations out into the weekend. After a tense day of negotiations on Saturday, which included a threat from the EU that it might walk away from the talks, parties managed to reach agreement on issues in the early hours of Sunday morning, while the dawn call to prayer echoed across Egypt. 

With people all over the world increasingly struggling to handle the fallout of extreme weather events exacerbated by climate change, the need to establish ways to mitigate the effects of the crisis, adapt to protect against further harms and provide relief to those suffering its worst effects has only become more urgent. Many people, activists in particular, feel UN summits are ineffective forums for building consensus and taking action on climate, due to the glacial pace of change. But the climate talks remain important, as they're the only chance all countries have to gather in a room and decide how to jointly tackle the climate crisis, a problem that knows no borders.

The theme of this year's summit was ""the implementation COP,"" which meant putting into action what had been agreed in Glasgow at COP26 last year, after the interim period had seen very little of what was promised there come to fruition. But on Friday, when the summit was set to close, negotiators were once again rehashing the same issues as in previous years, leading Greenpeace Southeast Asia Executive Director Yeb Saño to say it felt more like ""the repetition COP.""

The Egyptian climate talks were beset with problems, which ranged from practical issues around lack of food and drink at the event site, overcrowded transportation, and sewage running through the venue, to procedural issues that delayed negotiations. In the middle of the second week, Guterres flew back to Egypt from the G20 summit in Bali to urge parties to rise to the occasion and work together in spite of what he identified as a breakdown in trust between developed and developing nations.

""The world is watching and has a simple message: stand and deliver,"" he said in a speech Thursday. ""Deliver the kind of meaningful climate action that people and planet so desperately need.""

Loss and damage

Securing a fund for loss and damage has been the defining issue of the summit. It was such a priority for vulnerable countries and activists, that many said they'd consider COP27 a failure if agreement on a funding facility wasn't established.

For the first time after more than 30 years of activist campaigning, the issue made it onto the COP27 agenda this year. But even though financing garnered support from the G77+China and the EU, the contentious nature of compensation meant that this was one of two negotiating points that caused the negotiations to run late. 

The US, the world's largest historical emitter of greenhouse gases, has been particularly concerned about making itself liable, leading it to resist the creation of a fund. It showed more willingness to talk about loss and damage at COP27 than in the past, but wanted to shift the responsibility away from governments, which it said would only be able to contribute billions, to industry, which would be able to cough up the trillions truly required.

In the end, the countries were able to reach agree that a fund should be established, which was seen as a win for climate justice -- the movement to make the world safer, greener and more equal and fair. Saño described it as ""a victory for people power.""

""The agreement for a Loss and Damage Finance Facility marks a new dawn for climate justice,"" he said in a statement. ""Governments have laid the cornerstone of a long overdue new fund to deliver vital support to vulnerable countries and communities that are already being devastated by the accelerating climate crisis.""

There is still anger from some corners that it took so long for governments in the developed world to acknowledge the importance of loss and damage and stood in the way of progress. ""The EU should be ashamed of itself for blocking it for so long,"" said Wiktoria Jędroszkowiak, a Polish activist from youth organization Fridays for Future. ""This COP wasn't ambitious -- it was a fight to secure agreements that are still leading us towards the ongoing climate disasters.""

Fossil fuels

Securing funding for loss and damage is going to be more necessary than ever if the climate crisis continues to gather pace. Critics of the final deal argued that this would be the case due to the lack of focus on actually trying to reduce emissions by weaning ourselves off fossil fuels.

The language around phasing out fossil fuels was the other issue that held up the negotiations this year. Scientists and climate experts have consistently argued that the only way to keep global warming to within a 1.5 degree Celsius limit is to phase out all fossil fuels entirely, including coal, oil and gas. But some countries have resisted such rapid and all-encompassing decarbonization, leading to a tussle over how fossil fuel phaseout should be written in.

In the end, the language was excluded entirely.

""While the long-delayed progress on loss and damage is an important breakthrough, the latest draft of the cover text completely fails to address the fossil fuels that are driving the climate crisis and the escalating losses it is causing,"" Carroll Muffett, president and CEO of the Center for International Environmental Law, said in a statement.

Muffett also expressed her frustration that parties were told to update their nationally determined contributions, or NDCs, which say how each country would meet its commitments under the Paris Agreement without being told to increase their ambition and tackle the root causes of the climate crisis. She was one of a chorus of voices deeply frustrated at the lack of focus on fossil fuels and renewables.

""There is no time left for incremental change, every fraction of a degree matters,"" May Boeve, executive director of 350.org, said in a statement. ""We needed radical implementation of measures to keep to 1.5 degrees Celsius and avoid the worst ravages of climate chaos, we needed a swift, just and equitable phaseout of fossil fuels. We didn't get that at COP this year.""

In the absence of fossil fuels from the deal this year, some civil society members and activists are taking heart from the fact that the transition to renewable energy is already underway around the world. Already they're looking to next year's summit, which will take place in the United Arab Emirates, to advance this transition further and will likely be lobbying for this to be front and center on the 2023 agenda.

""The COP28 climate summit next year must be the COP of climate credibility,"" Manuel Pulgar-Vidal, COP20 president and WWF global climate and energy lead, said in a statement. ""And countries must deliver.""

First published on Nov. 19, 2022 7:10 p.m. PT",https://www.cnet.com/science/climate/at-cop27-an-historic-deal-to-compensate-poor-nations-for-climate-crisis-impacts/
