date,title,content,articles,url
5/10/2023,Pulling Power From the Ocean Is the Final Frontier for Renewable Energy,"From tide-turned turbines to pulling power up from the depths, marine energy is getting a boost in the fight against climate change.","Start video
Large play-pause toggle
Play pause
Fullscreen
Science
Pulling Power From the Ocean Is the Final Frontier for Renewable Energy

From tide-turned turbines to pulling power up from the depths, marine energy is getting a boost in the fight against climate change.

Eric Mack
Contributing Editor
Contributing editor Eric Mack covers space, science, climate change and all things futuristic. His encrypted email for tips is ericcmack@protonmail.com.
See full bio
Eric Mack
May 10, 2023 4:00 a.m. PT
6 min read

A buoy-based wave energy converter from wave energy technology company OceanEnergy.

OceanEnergy/PNNL
This story is part of CNET Zero, a series that chronicles the impact of climate change and explores what's being done about the problem.

With 70% of the Earth's surface covered by oceans, wave power could arguably be one of our largest untapped energy resources. If you've ever been knocked off your feet by a big wave, you've felt a smidgeon of that power. 

For decades, scientists and engineers have looked to our vast oceans and dreamed of ways to extract a tiny fraction of that energy. In an era of climate awareness and anxiety, finding ways to do that is finally getting more attention. 

The Biden administration's Ocean Climate Action Plan reveals how the ocean holds important potential for renewable energy, both from offshore wind power and less-explored sources such as waves, tides and currents. Even the chillier waters that lie deep below tropical seas could provide clean marine energy.

The plan acknowledges an ambitious endeavor nearing completion off the coast of Oregon, where 7 miles of conduit were laid under the floor of the Pacific Ocean using pioneering horizontal drilling techniques. Soon, thick cables will be run through that conduit to connect the mainland to PacWave, an offshore experimental testbed built to develop and demonstrate new technology that converts the power of waves into onshore electricity. 

Once fully operational (as soon as 2025), PacWave could generate up to 20 megawatts, enough to power a few thousand homes. ""I get really excited about wave energy because the resource is so large,"" Levi Kilcher, a senior scientist with the National Renewable Energy Laboratory, told me. 

An illustration of PacWave's planned infrastructure.

Oregon State University

Kilcher is a lead author on the 2021 NREL report that compiled available data on marine energy sources in the US, including waves, tides and ocean currents. The team found that the total energy potential is equal to more than half (57%) of the electricity generated in the US in a single year.  

""I get really excited about wave energy because the resource is so large.""
Levi Kilcher, senior scientist, National Renewable Energy Laboratory

Though experimental sites like PacWave point to an efficient way to harvest wave power and could facilitate breakthroughs, wave energy still has a way to go before becoming a significant source of electricity. Though waves are steady, they aren't identical, posing a key challenge in designing a machine to capture their energy.

""You're trying to tune [the technological approach] so you can take advantage of these shifting kinds of waves,"" said Andrea Copping, a senior researcher at the Pacific Northwest National Laboratory.

Differing approaches to capturing wave energy include devices that ride the top of waves or ones that translate the pressure waves put on the seafloor into power. Another approach involves devices called oscillating water columns, which compress air as waves rush through them. That compressed air spins a turbine and generates energy.

Power from the depths

Waves are just one potential source of marine energy that scientists and officials are investigating. 

Copping says there's renewed interest in another form of marine energy: ocean thermal energy conversion, or OTEC, which involves bringing up colder water from deeper parts of the ocean. This chilly flow then goes through a heat exchange process with warmer surface water, similar to the way home heat pumps exchange hot and cold air. That process drives a turbine to generate electricity. 

OTEC technology was pioneered in the 1970s when energy prices soared, but it never really caught on. According to Copping, climate change has led to more attention on OTEC, which could be a fit for islands like Puerto Rico, Guam and small nations in the South Pacific. 

""There's a real interest, and we really think it's going to go this time,"" Copping said.

A small OTEC plant has been functioning in Hawaii for years. Copping believes new commitments from the US government hold promise for the future of the technology, which has also seen significant interest in Japan and other surrounding nations. 

It's possible that concern over climate change could unlock new sources of funding for OTEC. In the meantime, building smaller facilities (10 megawatts or less) and putting them on land instead of floating on the ocean is making the tech more affordable, Copping said.

There's also the added bonus that the cold water pipes can double as a form of air conditioning in the tropical locales where OTEC works best. 

Going with the flow

Much of the US coastline, like Alaska, the Pacific Northwest and the rocky shores of Maine, has climates where there's little chance of finding surface water warm enough for OTEC. Fortunately, some of these spots are optimal for generating power from a source that relies on shallower water: tides. 

Growing up in Alaska, Kilcher was always fascinated by the power of tides. But he had no idea that nearby Cook Inlet is considered one of the world's ideal spots for harnessing their energy. When Kilcher first started work at the National Renewable Energy Laboratory, he was surprised when his colleagues informed him that this hometown of Homer, Alaska, was among the best tidal energy spots in the world. 

When it comes to converting the ocean's movements into electricity, tidal energy technology is the most developed -- it's about as simple as putting the right turbine in the right place in the water. A number of tidal-power projects have already been deployed in Europe and elsewhere, as well as in niche applications around the world. 

Tidal energy is the yin to the yang of wave energy. Waves can be anywhere and everywhere, but they're hard to predict. Tides are a mostly known quantity and are global, but their power potential is restricted to a few very specific places. The fast flows required to generate power are typically only found in narrow channels or between islands and the mainland. Still, where tidal energy works, it's a very reliable form of renewable energy.

""One thing that makes tidal energy especially attractive is it's 100% predictable,"" Kilcher said. 

Waves (the tallest in red and shortest in blue) arrive along the west coast of the United States in this accelerated animation. 

Zhaoqing Yang/Pacific Northwest National Laboratory

Some smaller experiments are being run with other consistent characteristics of oceans besides tides, like their major, slow-moving currents. Kilcher noted that research is underway off the coast of the southeastern US to examine how much power can be pulled out of currents before impacting heat circulation patterns in the North Atlantic.  

""You don't want to be extracting so much energy that the Gulf Stream starts to shut down,"" he said. ""These are the kind of scientific research questions that we look at.""

Thar she blows

So far, effectively pulling power from the ocean has less to do with water than with the air above it. Offshore wind energy is by far the most productive source of power that we transfer from ocean to land. 

""Offshore wind is the most mature technology without a doubt,"" Bryson Robertson, director of the Pacific Marine Energy Center at Oregon State University, told me. ""We've been working on wind energy systems really since the birth of civilization. We were running sails [on boats], and we were using windmills to grind wheat.""

""We've been working on wind energy systems really since the birth of civilization. We were running sails [on boats], and we were using windmills to grind wheat.""
Bryson Robertson, director, Pacific Marine Energy Center at Oregon State University

Large, power-generating wind turbines anchored to the seafloor have become a familiar sight off the coast of the northeastern states and other locales. Robertson says that floating offshore wind turbines are a newer, promising technology that could help scale up the amount of electricity we literally pull out of thin air.

Wind is more consistent offshore, and floating infrastructure can be deployed in more parts of the world and on deeper seas. And taller turbines could access high-altitude winds in locations that are out of the view of the public.

Robertson believes the opportunities to generate more wind power from floating infrastructure are significant enough to make a real dent in carbon emissions. 

A tough environment

Unlike developing a new mobile app or even a mobile phone, building the infrastructure to pull power from one of the most inhospitable and untamed environments on Earth can be a slow, difficult process. 

""We know less about these tidal raises, these big wave areas because we stay out of them,"" Copping said. ""That's one of the reasons this is taking time. But just look at the ocean -- it's hard not to see the energy potential.""

There are also a number of other considerations, including the impacts marine energy infrastructure could have on wildlife, the broader environment, local populations, fishing and other industries.

A research diver inspects a hydrophone lander deployed on the seafloor as part of ongoing research to improve the environmental monitoring of marine energy devices. 

Richard Walsh/Scripps Institution of Oceanography

""I think the biggest issue is uncertainty,"" Robertson added. ""We haven't done this at scale before, so what are the environmental impacts going to be?""

He says the policy process may be slow for good reasons, but the need for marine energy is still urgent.

""We need to find a way to deploy technology faster while being cognizant of the environment,"" he said. ""We just need to find a way to accelerate this process if we're going to have a measurable impact on climate change.""

More on renewable energy
What It Takes to Go Off the Grid With Solar Panels
Best Solar Companies of 2023

Solar Power Is Renewable Energy. Here's Why That Matters
How Hundreds of 24-Ton Bricks Could Fix a Huge Renewable Energy Problem 
The Green Revolution Is Being Held Back by Red Tape
First published on May 10, 2023 4:00 a.m. PT",https://www.cnet.com/science/pulling-power-from-the-ocean-is-the-final-frontier-for-renewable-energy/
5/7/2023,My Huge EV Road Trip Around Europe Was Shockingly Easy,Long-distance electric travel across the continent has never been smoother.,"Start video
Large play-pause toggle
Play pause
Fullscreen
Cars
My Huge EV Road Trip Around Europe Was Shockingly Easy

Long-distance electric travel across the continent has never been smoother.

Andrew Lanxon
Editor At Large, Lead Photographer, Europe
Andrew is CNET's go-to guy for product coverage and lead photographer for Europe. When not testing the latest phones, he can normally be found with his camera in hand, behind his drums or eating his stash of home-cooked food. Sometimes all at once.
Expertise
Smartphones, Photography, iOS, Android, gaming, outdoor pursuits
Credentials
Shortlisted for British Photography Awards 2022, Commended in Landscape Photographer of the Year 2022
See full bio
Andrew Lanxon
May 7, 2023 5:20 p.m. PT
5 min read
Andrew Lanxon/CNET
This story is part of CNET Zero, a series that chronicles the impact of climate change and explores what's being done about the problem.

Back in 2016, I drove over 1,000 miles from the UK to Barcelona on electric power alone. It was an odyssey, with difficult-to-find chargers resulting in big delays, almost costing me my job. This year, with so many improvements to the EV infrastructure across Europe, I tried it again. 

It wasn't just easier this time. It was downright bliss. 

My 2016 journey was supposed to be simple. I had taken a Tesla Model S -- a car with 300 miles range per charge -- to Barcelona to attend the Mobile World Congress tech show for CNET. I relied on Tesla's Supercharger network that recharged the car in around 30 to 40 minutes. I had calculated the distances between the chargers and was confident I could make the journey in the allotted time. 

I was naive.

Achieving the car's maximum range was difficult at inefficient highway speeds. None of the superchargers were easily accessible, with most being in the back of business hotels on commercial estates far from the highways, resulting in long setbacks. I arrived in Barcelona almost 9 hours late. My boss wasn't happy. 

But all of this has changed. In 2016, France had around 15,000 public EV chargers, but as of December 2022, that number has ballooned to over 82,000. And a huge number are fast chargers situated at highway rest stops, meaning that taking your electric vehicle on a long-distance trip is quicker and more manageable. 

Find the right car for you
View Local Inventory

It was easy to find fast-charging spots using the Shell Recharge app. 

Andrew Lanxon/CNET

I did this year's long-distance journey in early March to attend the 2023 Mobile World Congress again. I drove the VW ID 5, an all-electric SUV with a range of up to 314 miles. Setting off with a full battery from North London at 4 a.m., I used Google Maps to go straight to the Channel Tunnel departures on the UK's South Coast, getting the car onto the train that would take me under the sea, and then emerging in Calais, France, around 40 minutes later.

Driving a non-Tesla EV, I had to rely on third-party public chargers, which I was able to find using the Shell Recharge app. Thankfully, there are plenty of options now, such as Ionity, Total, Shell and others offering fast 150kW charging (or higher, in many cases) that would take the car to 80% in around 30 minutes. The Shell Recharge app shows all brands and allows you to pay through the app. (Most chargers don't accept contactless credit cards, and instead require ID cards specific to the service.)

Read more: Electric Vehicle Sales Expected to Increase in 2023

Driving the car onto a train beneath the sea is always fun.

Andrew Lanxon/CNET

With the app, I found my way to the first Ionity fast-charging station, situated at a rest stop on the highway southeast of Calais. This was already a big improvement over my last journey -- I didn't have to drive 20 minutes or more to find a charger behind an Ibis or Mercure hotel. And since it was a rest stop, I was able to get a coffee and a croissant while the car charged. By the time I'd finished my breakfast and stretched my legs, the car was ready to go. 

The massive increase in charging stations meant that brimming the EV battery wasn't difficult. Seven years ago, I had to map out the exact route to maximize efficiency and avoid getting stuck without power. This time, I just pointed the car down the highway direct to Barcelona, hopping between fast chargers as needed.

Before hitting the South Coast en route to my destination, I made an overnight stop just North of Lyon. I'm glossing over about 15 hours of travel because it was totally unremarkable -- which in and of itself is remarkable. There was no shortage of chargers, no problems or long waits at the chargers and, as a result, no range anxiety. It was an easy drive, just like it would be in a gas-powered (petrol) car. I was impressed. Even in 2021 in Scotland, I had problems with entire banks of chargers being out of order for weeks at a time. 

Read more: Used EVs Are a Hot New Market for Car Buyers

The VW ID 5 was comfortable to drive every mile of my journey. 

Andrew Lanxon/CNET

The VW ID 5 made it an extremely comfortable journey -- smooth to drive, with adaptive cruise control and steering assistance to maintain lane position -- and the highway miles simply flew by. Even the seats felt supportive for the long stints between breaks, and the sound system made my Periphery-heavy playlist boom. 

I reached Barcelona early on my third day and stowed the car in a downtown parking lot for the duration of the conference. Before leaving, I plotted a route to a fast charger just outside the city, where I gave it a full top-off while having breakfast. My return route was a bit rural, snaking my way up through the French Dordogne region, where charging was certain to be difficult. 

There are far fewer chargers away from the main intercity highways and even fewer fast chargers. In the historic village of La Roque-Gageac, there was a charging station for just one vehicle, but it was out of order. Fortunately, the generous range of the ID 5 gave me enough power to get 30 minutes north to a fast charger outside the town of Montignac. 

By relying on fast chargers, I didn't have wait long to get back on the road.

Andrew Lanxon/CNET

Throughout my entire journey, totaling over 2,000 miles, it was the only instance I had to make an adjustment to my charging route. And given how taxing I've found other long-distance EV road trips, that was wonderful. 

Instead of having to keep one eye constantly on the range, I could enjoy the beautiful journey through the South of France countryside. The ID 5's range combined with the number of public chargers in France meant I didn't need to overly plan my route and could instead go charging when I needed to. 

It was exactly what a road trip should be -- genuinely experiencing the pleasure of the drive and not having to worry about the logistics of refueling. I'm encouraged that the huge investment in EV infrastructure across Europe has made long-distance travel more feasible, not just for business trips, but for families trying to avoid spending hours at slow chargers with impatient children. 

Ionity fast chargers were plentiful, and I never had to wait to charge.

Andrew Lanxon/CNET

Had I done the 2,100-mile journey in a gas-powered car, I would have spent around £409 ($510), based on burning fuel at 35 mpg and refueling at 150 pence per liter. With an EV, I spent only around £308 ($384) on electricity -- big savings. And that's despite the energy crisis in Europe hiking up the cost of electricity, and also despite my pay-as-you-go charging method being more expensive than using a charging provider's subscription plans. Plus, the Shell Recharge app tells me I saved around 450 kg of CO2 on my electric-only journey. 

Read more: How to Claim the EV Tax Credit and Which Cars Qualify for It

My EV experience was very different from what I found back in 2016.

Andrew Lanxon/CNET

Sure, there's still room for improvement. Rural driving is trickier than it is on major highways, and I don't know why all chargers don't accept contactless credit cards (a common problem with charging stations in the US, too). There are a wide number of charging operators, and while most can use the Shell app (or a similar app called Bonnet), others didn't allow any app payments. Relying on the app also means you need cellular service to authorize the payment, something that may not be available in rural areas (although I had no reception problems on my trip).

Overall, I'm pleased that my fresh attempt at this journey was a success. And I'm extremely pleased at how easy it's become to drive zero-emission EVs in Europe. 

First published on May 6, 2023 3:00 a.m. PT",https://www.cnet.com/roadshow/news/my-huge-ev-road-trip-around-europe-was-shockingly-easy/
